id,name,Category,subcategory,description,website,github,license,platforms,tags,difficulty,self_hosted,year_started
mnemosyne,Mnemosyne,Education,learning,"""Flashcard learning application that applies spaced repetition algorithms to help users retain knowledge over time.""",https://mnemosyne-proj.org/,https://github.com/mnemosyne-proj/mnemosyne/,GPL,linux|macos|windows,cross-platform|offline-capable|local-first|beginner-friendly,beginner,FALSE,2006
seafile,Seafile,Utilities,file-storage|backup|collaboration,"""File syncing and sharing platform for storing and accessing files across devices, with options for self-hosting and encrypted data storage.""",https://www.seafile.com/,https://github.com/haiwen/seafile/,AGPL,web|linux|macos|windows,self-hosted|synchronization|multi-user|encrypted|privacy-focused|file-management|cloud,intermediate,TRUE,2012
librewolf,LibreWolf,Privacy,browsers,"""Privacy-focused web browser based on Firefox with hardened settings, tracker blocking, and removal of telemetry for a more secure browsing experience.""",https://librewolf.net/,https://codeberg.org/librewolf/source/,MIT,linux|macos|windows,cross-platform|privacy-focused|no-tracking|customizable,intermediate,FALSE,2021
mullvad-browser,Mullvad Browser,Privacy,browsers,"""Web browser developed in collaboration with the Tor Project to minimize tracking and fingerprinting, offering strong privacy protections without requiring the Tor network.""",https://mullvad.net/en/browser,https://gitlab.torproject.org/tpo/applications/mullvad-browser/,MPL,linux|macos|windows,cross-platform|privacy-focused|no-tracking|anonymous,intermediate,FALSE,2023
mullvad-vpn,Mullvad VPN,Privacy,vpn,"""Virtual private network service that encrypts internet traffic and hides user IP addresses, designed for strong privacy with minimal data collection and anonymous account options.""",https://mullvad.net/,https://github.com/mullvad/mullvadvpn-app/,GPL,linux|macos|windows|android|ios,cross-platform|privacy-focused|encrypted|anonymous,beginner,FALSE,2009
wordpress,WordPress,Development,website-builders,"""Content management system for building websites and blogs, with a large ecosystem of themes and plugins for customization and publishing workflows.""",https://wordpress.org/,https://github.com/WordPress/WordPress/,GPL,web|linux|macos|windows,self-hosted|multi-user|plugin-based|customizable|api,beginner,TRUE,2003
deepseek,DeepSeek,AI,llm-tools,"""Large language model platform for text generation, reasoning, and coding tasks, accessible through APIs and interfaces for building AI-powered applications.""",https://www.deepseek.com/,https://github.com/deepseek-ai/,MIT,web|linux|macos|windows,api|llm|cloud,intermediate,FALSE,2023
qwen,Qwen,AI,llm-tools,"""Open-weight language model family for text generation, reasoning, coding, and agent-style workflows, with public weights and tooling for self-hosted use and API-based integration.""",https://qwenlm.ai/,https://github.com/QwenLM/Qwen3/,Apache,web|linux,self-hosted|api|llm,advanced,TRUE,2023
llama,Llama,AI,llm-tools,"""Large language model family from Meta for text generation, reasoning, and coding workloads, with downloadable weights and tooling for local and server-side deployment.""",https://www.llama.com/,https://github.com/meta-llama/llama3/,Llama,web|linux,self-hosted|api|llm,advanced,TRUE,2024
mistral,Mistral,AI,llm-tools,"""Open model family for text generation, reasoning, coding, and multimodal tasks, with official inference tooling and Apache-licensed model releases.""",https://mistral.ai/,https://github.com/mistralai/mistral-inference/,Apache,web|linux,self-hosted|api|llm|cloud,advanced,TRUE,2023
olmo,OLMo,AI,llm-tools,"""Fully open language model family released with code, weights, and supporting research artifacts for training, evaluation, and self-hosted inference.""",https://allenai.org/olmo/,https://github.com/allenai/OLMo-core/,Apache,web|linux,self-hosted|api|llm,advanced,TRUE,2024
bloom,BLOOM,AI,llm-tools,"""Multilingual large language model family built by BigScience for text generation and research, with public weights for self-hosted inference and adaptation.""",https://huggingface.co/bigscience/bloom/,https://huggingface.co/bigscience/bloom/,Custom,web|linux,self-hosted|llm,advanced,TRUE,2022
gemma,Gemma,AI,llm-tools,"""Open-weight model family from Google DeepMind for text and multimodal generation, with downloadable weights and official libraries for local development and fine-tuning.""",https://ai.google.dev/gemma/,https://github.com/google-deepmind/gemma/,Custom,web|linux,self-hosted|api|llm,advanced,TRUE,2024
mimo,MiMo,AI,llm-tools,"""Open language model family from Xiaomi focused on reasoning and agentic performance, with public model code and weights for self-hosted experimentation and deployment.""",https://github.com/XiaomiMiMo/MiMo/,https://github.com/XiaomiMiMo/MiMo/,Apache,web|linux,self-hosted|api|llm,advanced,TRUE,2025
kimi,Kimi,AI,llm-tools,"""Open model family from Moonshot AI for reasoning, coding, and agentic workloads, with public model repositories and downloadable weights for self-hosted use.""",https://kimi.ai/,https://github.com/MoonshotAI/Kimi-K2/,MIT|Custom,web|linux,self-hosted|api|llm|cloud,advanced,TRUE,2025
openclaw,OpenClaw,AI,llm-tools,"""Personal AI assistant platform that runs on your own devices and connects to messaging channels, voice interfaces, and automation workflows with a self-hosted control plane.""",https://openclaw.ai/,https://github.com/openclaw/openclaw/,MIT,linux|macos|windows|android|ios,self-hosted|multi-user|api|customizable,advanced,TRUE,2026
littlebigmouse,Little Big Mouse,Utilities,system-tools,"""Multi-monitor utility for Windows that makes cursor movement feel consistent across displays with different DPI scaling, resolutions, and physical sizes.""",,https://github.com/mgth/LittleBigMouse/,GPL,windows,offline-capable|lightweight|customizable,beginner,FALSE,2015
lustra,Lustra,Productivity,knowledge-base,"""Civic platform for tracking legislation, reading neutral bill summaries, reviewing source documents, and participating in public drafting and voting workflows.""",https://lustra.news/,https://github.com/fokdelafons/lustra/,AGPL,web|android|ios,self-hosted|cloud|multi-user|organization,beginner,TRUE,2026
vscodium,VSCodium,Development,code-editing,"""Telemetry-free build of Visual Studio Code that provides a full-featured code editor with extensions, debugging, and customization without proprietary tracking components.""",https://vscodium.com/,https://github.com/VSCodium/vscodium/,MIT,linux|macos|windows,cross-platform|customizable|plugin-based|no-tracking,intermediate,FALSE,2018
rustdesk,RustDesk,Networking,remote-access,"""Remote desktop software for accessing and controlling computers over a network, with support for self-hosting and encrypted connections for privacy-focused remote access.""",https://rustdesk.com/,https://github.com/rustdesk/rustdesk/,AGPL,linux|macos|windows|android|ios,self-hosted|cross-platform|encrypted,beginner,TRUE,2020
okular,Okular,Productivity,document-editing,"""Document viewer for PDFs and other formats with support for annotations, highlighting, and reading tools across multiple document types.""",https://okular.kde.org/,https://invent.kde.org/graphics/okular/,GPL,linux|windows,cross-platform|offline-capable,beginner,FALSE,2005
ventoy,Ventoy,Utilities,system-tools,"""Tool for creating bootable USB drives that can hold multiple ISO files, allowing users to boot and install operating systems without reformatting the drive.""",https://ventoy.net/,https://github.com/ventoy/Ventoy/,GPL,linux|windows,offline-capable|lightweight,beginner,FALSE,2020
borgbackup,BorgBackup,Utilities,backup,"""Deduplicating backup tool designed for efficient and secure backups, supporting encryption, compression, and incremental storage.""",https://www.borgbackup.org/,https://github.com/borgbackup/borg/,BSD,linux|macos,cli|encrypted|backup|advanced-users,advanced,FALSE,2015
stirling-pdf,Stirling PDF,Utilities,document-editing,"""Self-hosted PDF toolkit for editing, merging, splitting, and converting PDF files through a web interface with a wide range of document operations.""",https://stirlingpdf.io/,https://github.com/Stirling-Tools/Stirling-PDF/,MIT,web|linux,self-hosted|multi-user,beginner,TRUE,2023
mpv,mpv,Media,media-players,"""Lightweight media player for video and audio playback with high-quality rendering, scripting support, and a focus on minimal interface design.""",https://mpv.io/,https://github.com/mpv-player/mpv/,GPL,linux|macos|windows,cross-platform|offline-capable|minimalist,advanced,FALSE,2012
freshrss,FreshRSS,Productivity,bookmarking,"""Self-hosted RSS reader for aggregating and organizing feeds, with support for automation, filtering, and multi-user access through a web interface.""",https://freshrss.org/,https://github.com/FreshRSS/FreshRSS/,AGPL,web|linux,self-hosted|multi-user|automation|organization,intermediate,TRUE,2013
double-commander,Double Commander,Utilities,file-management,"""Dual-pane file manager inspired by Total Commander, offering advanced file operations, tabbed browsing, and plugin support.""",https://doublecmd.sourceforge.io/,https://github.com/doublecmd/doublecmd/,GPL,linux|macos|windows,cross-platform|offline-capable|file-management|customizable,intermediate,FALSE,2007
cryptomator,Cryptomator,Utilities,encryption,"""Encryption tool for securing files in cloud storage by creating encrypted vaults that protect data before it is uploaded or synced.""",https://cryptomator.org/,https://github.com/cryptomator/cryptomator/,GPL,linux|macos|windows|android|ios,cross-platform|encrypted|privacy-focused|file-management,beginner,FALSE,2016
ollama,Ollama,AI,model-management|local-ai,"""Local model runtime and manager for downloading, switching between, and serving open language models through a simple CLI, desktop app, and REST API.""",https://ollama.com/,https://github.com/ollama/ollama/,MIT,linux|macos|windows,self-hosted|api|local-first|llm,beginner,TRUE,2023
anythingllm,AnythingLLM,AI,model-management|local-ai,"""Self-hosted AI workspace for connecting, managing, and using local or cloud language models with chat, documents, agents, and multi-user support.""",https://anythingllm.com/,https://github.com/Mintplex-Labs/anything-llm/,MIT,linux|macos|windows,self-hosted|multi-user|api|customizable|llm|cloud,intermediate,TRUE,2023
auditd,auditd,Security,auditing,"""Linux auditing daemon for recording security-relevant system events, system calls, and policy-defined activity, with tools for searching and reporting on audit logs.""",https://people.redhat.com/sgrubb/audit/,https://github.com/linux-audit/audit-userspace/,GPL|LGPL,linux,cli|real-time|monitoring|advanced-users,advanced,FALSE,2003
lynis,Lynis,Security,auditing|vulnerability-scanning,"""Security auditing and hardening tool for Linux, macOS, and Unix-like systems that scans for weaknesses, compliance issues, and misconfigurations.""",https://cisofy.com/lynis/,https://github.com/CISOfy/lynis/,GPL,linux|macos,cli|cross-platform|advanced-users,advanced,FALSE,2007
openscap,OpenSCAP,Security,auditing|vulnerability-scanning,"""Security compliance and configuration assessment toolkit for validating SCAP content, auditing systems against baselines, and running configuration or vulnerability scans.""",https://www.open-scap.org/,https://github.com/OpenSCAP/openscap/,LGPL,linux,cli|api|automation|advanced-users,advanced,FALSE,2008
aide,AIDE,Security,auditing,"""File and directory integrity checker that builds a trusted database of filesystem metadata and detects unauthorized changes to monitored files.""",https://aide.github.io/,https://github.com/aide/aide/,GPL,linux|macos,cli|monitoring|advanced-users,advanced,FALSE,1999
wazuh,Wazuh,Security,auditing|vulnerability-scanning,"""Security platform for threat detection, file integrity monitoring, compliance workflows, and centralized analysis of data collected from monitored endpoints.""",https://wazuh.com/,https://github.com/wazuh/wazuh/,GPL,web|linux|macos|windows,api|cloud|self-hosted|multi-user|monitoring|real-time|cross-platform,advanced,TRUE,2015
zeek,Zeek,Networking,network-communication,"""Network security monitoring platform that analyzes traffic in real time and produces high-fidelity logs for investigation, detection, and traffic analysis.""",https://zeek.org/,https://github.com/zeek/zeek/,BSD,linux|macos,cli|monitoring|real-time|advanced-users,advanced,FALSE,1998
leek,Leek,Security,auditing|vulnerability-scanning,"""CLI and .NET security auditing tool for detecting breached or weak secrets such as passwords, with support for offline wordlists, APIs, and hash-based analysis.""",https://github.com/SignatureBeef/leek/,https://github.com/SignatureBeef/leek/,GPL,windows,cli|api|offline-capable|advanced-users,advanced,FALSE,2025
remmina,Remmina,Networking,remote-access,"""Remote desktop client for connecting to systems over RDP, SSH, SPICE, VNC, and other protocols from a unified desktop interface.""",https://remmina.org/,https://github.com/FreeRDP/Remmina/,GPL,linux,plugin-based|advanced-users,intermediate,FALSE,2009
apache-guacamole,Apache Guacamole,Networking,remote-access,"""Clientless remote desktop gateway that provides browser-based access to systems over protocols like RDP, VNC, and SSH.""",https://guacamole.apache.org/,https://github.com/apache/guacamole-client/,Apache,web,self-hosted|api|multi-user|real-time,intermediate,TRUE,2013
meshcentral,MeshCentral,Networking,remote-access,"""Web-based remote management platform for remotely controlling computers with browser-based desktop, terminal, and file access, plus agent-based device management.""",https://meshcentral.com/,https://github.com/Ylianst/MeshCentral/,Apache,web|linux|macos|windows,self-hosted|api|multi-user|real-time|cross-platform,advanced,TRUE,2010
tigervnc,TigerVNC,Networking,remote-access,"""Remote desktop software that provides high-performance VNC client and server components for accessing and sharing graphical desktops across platforms.""",https://tigervnc.org/,https://github.com/TigerVNC/tigervnc/,GPL,linux|macos|windows,cross-platform|real-time|advanced-users,intermediate,FALSE,2009
xrdp,xrdp,Networking,remote-access,"""Remote Desktop Protocol server for Linux and Unix-like systems that lets standard RDP clients connect to graphical desktop sessions.""",https://www.xrdp.org/,https://github.com/neutrinolabs/xrdp/,Apache,linux,self-hosted|real-time|encrypted|advanced-users,advanced,TRUE,2004
7zip,7-Zip,Utilities,compression,"""File archiver for creating, extracting, and managing compressed archives, with high compression ratios, strong format support, and built-in command-line tools.""",https://www.7-zip.org/,https://sourceforge.net/projects/sevenzip/,LGPL|BSD|Custom,windows,cli|lightweight|beginner-friendly,beginner,FALSE,1999
peazip,PeaZip,Utilities,compression,"""Archive manager for compressing, extracting, and organizing files across many formats, with a desktop interface and advanced options for batch archive handling.""",https://peazip.github.io/,https://github.com/peazip/PeaZip/,LGPL,linux|macos|windows,cross-platform|lightweight|customizable|file-management,beginner,FALSE,2006
nanazip,NanaZip,Utilities,compression,"""Windows archive manager based on 7-Zip with a modern interface for creating, extracting, and browsing compressed files and archives.""",https://github.com/M2Team/NanaZip/,https://github.com/M2Team/NanaZip/,MIT|Custom,windows,lightweight|customizable|beginner-friendly,beginner,FALSE,2021
superset,Apache Superset,Data,data-visualization|analytics,"""Data exploration and dashboarding platform for querying sources, building charts, and sharing interactive visualizations across teams.""",https://superset.apache.org/,https://github.com/apache/superset/,Apache,web,self-hosted|api|plugin-based|multi-user|customizable|advanced-users,intermediate,TRUE,2015
metabase,Metabase,Data,data-visualization|analytics,"""Business intelligence platform for querying databases, building dashboards, and making metrics accessible through a simple web interface.""",https://www.metabase.com/,https://github.com/metabase/metabase/,AGPL,web,self-hosted|cloud|api|multi-user|customizable|beginner-friendly,beginner,TRUE,2015
redash,Redash,Data,data-visualization|analytics,"""Data query and dashboard platform for exploring multiple data sources, visualizing results, and sharing charts and dashboards with teams.""",https://redash.io/,https://github.com/getredash/redash/,BSD,web,self-hosted|api|multi-user|customizable|advanced-users,intermediate,TRUE,2013
subversion,Apache Subversion,Development,version-control,"""Centralized version control system for tracking changes to files and directories, with branching, tagging, and repository-based collaboration workflows.""",https://subversion.apache.org/,https://github.com/apache/subversion/,Apache,linux|macos|windows,cross-platform|cli|advanced-users|version-control,intermediate,FALSE,2000
mercurial,Mercurial,Development,version-control,"""Distributed version control system for managing source code with local commits, branching, merging, and scalable workflows across projects of many sizes.""",https://www.mercurial-scm.org/,https://www.mercurial-scm.org/repo/hg/,GPL,linux|macos|windows,cross-platform|cli|advanced-users|version-control,intermediate,FALSE,2005
cvs,CVS,Development,version-control,"""Centralized version control system for recording file history and coordinating changes across teams through a shared repository and client-server workflow.""",https://cvs.nongnu.org/,https://cvs.savannah.nongnu.org/viewvc/cvs/,GPL,linux|macos|windows,cross-platform|cli|advanced-users|version-control,advanced,FALSE,1986
insomnia,Insomnia,Development,api-tools,"""API client for designing, testing, and debugging REST, GraphQL, gRPC, WebSocket, and other HTTP-based APIs, with local, Git, and collaborative workflows.""",https://insomnia.rest/,https://github.com/Kong/insomnia/,Apache,linux|macos|windows,api|cross-platform|collaborative|customizable,beginner,FALSE,2016
bruno,Bruno,Development,api-tools,"""Git-native API client for working with REST, GraphQL, gRPC, and WebSocket APIs locally, with collections stored as plain files and no required cloud sync.""",https://www.usebruno.com/,https://github.com/usebruno/bruno/,MIT,linux|macos|windows,api|cross-platform|customizable|advanced-users,beginner,FALSE,2022
hoppscotch,Hoppscotch,Development,api-tools|testing,"""API development platform for sending requests, testing endpoints, documenting APIs, and collaborating through web, desktop, and self-hosted workflows.""",https://hoppscotch.com/,https://github.com/hoppscotch/hoppscotch/,MIT,web|linux|macos|windows,api|cross-platform|collaborative|multi-user,beginner,TRUE,2019
soapui,SoapUI Open Source,Development,api-tools|testing,"""API testing tool for functional, regression, and load testing of SOAP and REST services, with support for mocks, assertions, and automated test workflows.""",https://www.soapui.org/,https://github.com/SmartBear/soapui/,EUPL,linux|macos|windows,api|cross-platform|automation|advanced-users,intermediate,FALSE,2005
swagger-ui,Swagger UI,Development,api-tools,"""Interactive documentation interface that renders OpenAPI and Swagger definitions into a browser-based UI for exploring and trying API endpoints.""",https://swagger.io/tools/swagger-ui/,https://github.com/swagger-api/swagger-ui/,Apache,web,api|customizable,beginner,FALSE,2011
httpie,HTTPie,Development,api-tools,"""Command-line HTTP client for testing, debugging, and interacting with APIs and web services using readable syntax, formatted output, and plugin support.""",https://httpie.io/,https://github.com/httpie/cli/,BSD,linux|macos|windows,api|cli|plugin-based|advanced-users,beginner,FALSE,2012
apache-jmeter,Apache JMeter,Development,testing|api-tools,"""Load and performance testing tool for web applications, APIs, databases, and network services, with support for scripted test plans and extensible plugins.""",https://jmeter.apache.org/,https://github.com/apache/jmeter/,Apache,linux|macos|windows,api|automation|plugin-based|advanced-users,intermediate,FALSE,1998
rest-assured,REST Assured,Development,testing|api-tools,"""Java testing framework for validating REST APIs with a fluent DSL for requests, assertions, authentication, and response verification.""",https://rest-assured.io/,https://github.com/rest-assured/rest-assured/,Apache,linux|macos|windows,api|automation|advanced-users|cross-platform,intermediate,FALSE,2010
karate,Karate,Development,testing|api-tools,"""Unified test automation framework for API testing, mocks, performance testing, and UI automation, designed to let teams write executable tests with minimal boilerplate.""",https://karatelabs.github.io/karate/,https://github.com/karatelabs/karate/,MIT,linux|macos|windows,api|automation|advanced-users|cross-platform,intermediate,FALSE,2017
openvas,OpenVAS,Security,vulnerability-scanning,"""Vulnerability scanning engine in the Greenbone Community Edition for detecting exposed services, known weaknesses, and misconfigurations across target systems.""",https://greenbone.github.io/docs/latest/,https://github.com/greenbone/openvas-scanner/,GPL,linux,self-hosted|cli|advanced-users,advanced,TRUE,2005
nikto,Nikto,Security,vulnerability-scanning,"""Web server vulnerability scanner for identifying dangerous files, outdated software, misconfigurations, and known security issues in HTTP services.""",https://cirt.net/Nikto2/,https://github.com/sullo/nikto/,GPL,linux|macos|windows,cli|cross-platform|advanced-users,intermediate,FALSE,2001
nmap,Nmap,Security,vulnerability-scanning,"""Network scanner for discovering hosts, auditing exposed ports and services, and assessing network attack surface with a large scripting engine for deeper checks.""",https://nmap.org/,https://github.com/nmap/nmap/,NPSL,linux|macos|windows,cli|cross-platform|advanced-users,intermediate,FALSE,1997
searxng,SearXNG,Privacy,search-engines,"""Privacy-focused metasearch engine that aggregates results from multiple sources without tracking users and can be self-hosted for a customizable search experience.""",https://searxng.org/,https://github.com/searxng/searxng/,AGPL,web,self-hosted|customizable|privacy-focused|no-tracking,intermediate,TRUE,2021
yacy,YaCy,Privacy,search-engines,"""Decentralized peer-to-peer search engine that can run as a personal search portal, intranet search service, or shared web index without relying on a central provider.""",https://yacy.net/,https://github.com/yacy/yacy_search_server/,GPL,web|linux|macos|windows,self-hosted|cross-platform|privacy-focused|no-tracking,advanced,TRUE,2003
whoogle,Whoogle Search,Privacy,search-engines,"""Self-hosted privacy proxy for Google Search that removes ads, JavaScript, AMP links, and tracking while providing a lightweight search interface.""",https://github.com/benbusby/whoogle-search/,https://github.com/benbusby/whoogle-search/,MIT,web,self-hosted|privacy-focused|no-tracking|lightweight,intermediate,TRUE,2020
bind9,BIND 9,Networking,dns,"""DNS server suite for authoritative and recursive name service, with broad deployment in production networks and support for advanced zone and policy management.""",https://www.isc.org/bind/,https://github.com/isc-projects/bind9/,MPL,linux,self-hosted|advanced-users,advanced,TRUE,2000
powerdns,PowerDNS,Networking,dns,"""DNS server platform providing authoritative and recursive DNS software for large-scale deployments, with support for multiple backends and programmable integrations.""",https://www.powerdns.com/,https://github.com/PowerDNS/pdns/,GPL,linux,self-hosted|api|advanced-users,advanced,TRUE,2002
unbound,Unbound,Networking,dns,"""Validating recursive and caching DNS resolver focused on security, modern standards support, and high-performance local or network-wide name resolution.""",https://nlnetlabs.nl/projects/unbound/about/,https://github.com/NLnetLabs/unbound/,BSD,linux|macos|windows,self-hosted|api|advanced-users,advanced,TRUE,2008
knot-dns,Knot DNS,Networking,dns,"""Authoritative DNS server designed for high-performance and large-zone operation, with a focus on speed, automation, and resilient production use.""",https://www.knot-dns.cz/,https://github.com/CZ-NIC/knot/,GPL,linux|macos,self-hosted|advanced-users,advanced,TRUE,2011
dnsmasq,dnsmasq,Networking,dns,"""Lightweight DNS forwarder and DHCP service for small networks, routers, and local infrastructure, designed for low resource usage and simple configuration.""",https://thekelleys.org.uk/dnsmasq/doc.html,https://github.com/imp/dnsmasq/,GPL,linux|macos|android,self-hosted|lightweight|advanced-users,intermediate,TRUE,2001
pi-hole,Pi-hole,Networking,dns,"""Network-level DNS sinkhole that blocks ads and trackers across devices on a local network, with a web interface for managing filtering and query behavior.""",https://pi-hole.net/,https://github.com/pi-hole/pi-hole/,EUPL,linux,self-hosted|monitoring|multi-user,beginner,TRUE,2015
maradns,MaraDNS,Networking,dns,"""Lightweight DNS server that can operate as an authoritative or recursive nameserver, built for simple, secure deployment with minimal resource requirements.""",https://maradns.samiam.org/,https://github.com/samboy/MaraDNS/,BSD,linux|windows,self-hosted|lightweight|advanced-users,advanced,TRUE,2001
nginx,NGINX,Networking,proxies,"""Web server and reverse proxy for serving HTTP traffic, load balancing requests, caching content, and routing connections in production environments.""",https://nginx.org/,https://github.com/nginx/nginx/,BSD,linux|macos|windows,customizable|advanced-users,intermediate,TRUE,2004
