id,name,Category,subcategory,description,website,github,license,platforms,tags,difficulty,self_hosted,year_started
jaligner,JAligner,Data,data-processing,"""Java-based library for performing pairwise sequence alignments using dynamic programming algorithms for biological sequence comparison.""",http://jaligner.sourceforge.net/, ,GPL,linux|macos|windows,cross-platform|advanced-users|api,advanced,FALSE,2014
mafft,MAFFT,Data,data-processing,"""Multiple sequence alignment program for DNA and protein sequences, designed to handle large datasets with high speed and accuracy.""",https://mafft.cbrc.jp/alignment/software/, ,BSD,linux|macos,cli|cross-platform|advanced-users,advanced,FALSE,2002
muscle,MUSCLE,Data,data-processing,"""Sequence alignment tool for generating accurate multiple alignments of nucleotide or protein sequences with a focus on speed and scalability.""",https://drive5.com/muscle/, ,GPL,linux|macos|windows,cli|cross-platform|advanced-users,advanced,FALSE,2004
nextflow,Nextflow,Development,devops,"""Workflow orchestration framework for building and running scalable data pipelines, particularly in bioinformatics, with support for parallel execution and reproducibility.""",https://www.nextflow.io/,https://github.com/nextflow-io/nextflow/,Apache,linux|macos|windows|web,cli|automation|cross-platform|advanced-users|api,advanced,FALSE,2013
phyloscan,Phyloscan,Data,data-processing,"""Phylogenetic analysis pipeline for identifying and analyzing genetic relationships within sequence datasets, often used for pathogen and evolutionary studies.""", ,https://github.com/bpt26/phyloScan/,GPL,linux,cli|cross-platform|advanced-users,advanced,FALSE,2005
probalign,Probalign,Data,data-processing,"""Sequence alignment tool that uses probabilistic models to improve alignment accuracy, particularly for distantly related biological sequences.""",https://web.njit.edu/~usman/probalign/, ,GPL,linux,cli|cross-platform|advanced-users,advanced,FALSE,2006
probcons,ProbCons,Data,data-processing,"""Multiple sequence alignment program that applies probabilistic consistency-based methods to produce highly accurate alignments.""",http://probcons.stanford.edu/, ,GPL,linux|macos|windows,cli|cross-platform|advanced-users,advanced,FALSE,2005
stemloc,Stemloc,Data,data-processing,"""RNA alignment and folding tool that models both sequence and structural information to improve alignment accuracy for structured RNA molecules.""",http://biowiki.org/StemLoc, ,GPL,linux,cli|cross-platform|advanced-users,advanced,FALSE,2004
t-coffee,T-Coffee,Data,data-processing,"""Multiple sequence alignment suite that combines results from different alignment methods to produce consistent and high-quality alignments.""",https://tcoffee.crg.eu/, ,GPL,web|linux|macos|windows,cli|cross-platform|advanced-users,advanced,FALSE,2000
ugene,UGENE,Data,data-processing,"""Bioinformatics toolkit for analyzing DNA and protein sequences, with integrated tools for alignment, visualization, and workflow management in a unified interface.""",https://ugene.net/,https://github.com/ugeneunipro/ugene/,GPL,linux|macos|windows,cross-platform|advanced-users|customizable|api,advanced,FALSE,2008
yass,YASS,Data,data-processing,"""Sequence similarity search tool for detecting local alignments in DNA sequences, optimized for identifying repeats and regions of similarity.""",https://bioinfo.lifl.fr/yass/, ,GPL,linux,cli|cross-platform|advanced-users,advanced,FALSE,2005
librecad,LibreCAD,Design,vector-graphics,"""2D computer-aided design application for creating technical drawings, schematics, and plans using precise drafting tools.""",https://librecad.org/, ,LGPL,linux|macos|windows,cross-platform|offline-capable|lightweight|beginner-friendly|no-tracking,intermediate,FALSE,2010
solvespace,SolveSpace,Design,3d-modeling,"""Parametric 2D and 3D CAD program for designing mechanical parts and assemblies using constraints and dimensional relationships.""",https://solvespace.com/, ,GPL,linux|macos|windows,cross-platform|offline-capable|lightweight|advanced-users,advanced,FALSE,2008
brl-cad,BRL-CAD,Design,3d-modeling,"""Solid modeling system with tools for geometric analysis, ray tracing, and engineering design, used for complex 3D modeling tasks.""",https://brlcad.org/, ,LGPL,linux|macos|windows,cross-platform|cli|advanced-users|extensible,advanced,FALSE,1984
openscad,OpenSCAD,Design,3d-modeling,"""Script-based 3D modeling tool for creating parametric designs using code, suited for precise and reproducible geometric modeling.""",https://openscad.org/,https://github.com/openscad/openscad/,GPL,linux|macos|windows,cross-platform|cli|customizable|advanced-users,advanced,FALSE,2011
occt,Open Cascade Technology (OCCT),Development,api-tools,"""Software development framework for building 3D CAD, CAM, and CAE applications, providing libraries for modeling, visualization, and data exchange.""",https://www.opencascade.com/open-cascade-technology/,https://github.com/Open-Cascade-SAS/OCCT/,LGPL,linux|macos|windows,cross-platform|api|extensible|advanced-users,advanced,FALSE,1999
wings3d,Wings 3D,Design,3d-modeling,"""Subdivision modeling tool for creating and editing 3D polygonal meshes with a focus on ease of use and interactive modeling workflows.""",https://www.wings3d.com/, ,BSD,linux|macos|windows,cross-platform|offline-capable|customizable|advanced-users,intermediate,FALSE,2001
art-of-illusion,Art of Illusion,Design,3d-modeling,"""3D modeling and rendering application for creating scenes, animations, and visual effects with a plugin system for extending functionality.""",http://www.artofillusion.org/, ,GPL,linux|macos|windows,cross-platform|offline-capable|customizable|plugin-based,intermediate,FALSE,1999
meshlab,MeshLab,Design,3d-modeling|data-processing,"""Tool for processing and editing 3D meshes, including cleaning, repairing, converting, and analyzing scanned or generated models.""",https://www.meshlab.net/,https://github.com/cnr-isti-vclab/meshlab/,GPL,linux|macos|windows,cross-platform|offline-capable|advanced-users|customizable,advanced,FALSE,2005
makehuman,MakeHuman,Design,3d-modeling,"""3D modeling tool for creating realistic human characters with adjustable anatomy, proportions, and export options for use in animation and game development workflows.""",https://www.makehumancommunity.org/,https://github.com/makehumancommunity/makehuman/,GPL,linux|macos|windows,cross-platform|offline-capable|customizable|advanced-users,intermediate,FALSE,2000
sweet-home-3d,Sweet Home 3D,Design,3d-modeling,"""Interior design application for creating floor plans and arranging furniture in 2D, with a synchronized 3D preview for visualizing layouts.""",https://www.sweethome3d.com/, ,GPL,linux|macos|windows,cross-platform|offline-capable|beginner-friendly|customizable,beginner,FALSE,2006
gmsh,Gmsh,Design,3d-modeling|data-processing,"""3D finite element mesh generator with built-in CAD tools, scripting, and post-processing features for scientific and engineering simulations.""",https://gmsh.info/,https://gitlab.onelab.info/gmsh/gmsh/,GPL,linux|macos|windows,cross-platform|cli|api|advanced-users,advanced,FALSE,1998
electric,Electric,Design,vector-graphics,"""Electronic design automation system for creating circuit layouts, schematics, and integrated circuit designs with support for hierarchical design workflows.""",https://www.staticfreesoft.com/, ,GPL,linux|macos|windows,cross-platform|advanced-users|customizable,advanced,FALSE,1982
joplin,Joplin,Productivity,note-taking|knowledge-base,"""Note-taking and knowledge management app that stores notes locally with optional synchronization, supporting markdown, attachments, and structured organization.""",https://joplinapp.org/,https://github.com/laurent22/joplin/,AGPL,linux|macos|windows|android|ios,cross-platform|offline-capable|synchronization|local-first|knowledge-management|customizable,beginner,FALSE,2017
inkscape,Inkscape,Design,vector-graphics|illustration,"""Vector graphics editor for creating illustrations, diagrams, and designs using scalable paths, shapes, and advanced drawing tools.""",https://inkscape.org/,https://gitlab.com/inkscape/inkscape/,GPL,linux|macos|windows,cross-platform|offline-capable|customizable|advanced-users,intermediate,FALSE,2003
krita,Krita,Design,image-editing|illustration,"""Digital painting and illustration software designed for artists, featuring brush engines, layers, and tools for concept art, comics, and texture creation.""",https://krita.org/,https://github.com/KDE/krita/,GPL,linux|macos|windows,cross-platform|offline-capable|customizable|advanced-users,intermediate,FALSE,2005
bitwarden,Bitwarden,Security,password-managers|authentication,"""Password manager for securely storing and syncing credentials using end-to-end encryption, with support for vault organization and cross-device access.""",https://bitwarden.com/,https://github.com/bitwarden/,AGPL,web|linux|macos|windows|android|ios,cross-platform|encrypted|end-to-end-encryption|privacy-focused|synchronization|cloud|self-hosted|no-tracking,beginner,TRUE,2016
syncthing,Syncthing,Privacy,file-storage|backup|network-communication,"""Peer-to-peer file synchronization tool that keeps folders in sync across devices without relying on a central server, using encrypted connections.""",https://syncthing.net/,https://github.com/syncthing/syncthing/,MPL,linux|macos|windows|android|ios,cross-platform|synchronization|local-first|encrypted|privacy-focused|self-hosted|file-management|no-tracking,intermediate,TRUE,2014
element,Element,Privacy,messaging|network-communication,"""Messaging client built on the Matrix protocol for real-time communication, offering encrypted chat, voice, and video with support for group collaboration.""",https://element.io/,https://github.com/element-hq/element-web/,GPL,web|linux|macos|windows|android|ios,cross-platform|real-time|collaborative|multi-user|encrypted|end-to-end-encryption|privacy-focused,beginner,FALSE,2019
penpot,Penpot,Design,ui-ux|collaboration,"""Design and prototyping platform for creating user interfaces collaboratively in the browser, with support for real-time editing, reusable components, and self-hosted deployment.""",https://penpot.app/,https://github.com/penpot/penpot/,MPL,web,self-hosted|collaborative|real-time|multi-user|customizable,intermediate,TRUE,2021
firefox,Firefox,Privacy,browsers,"""Web browser focused on privacy and user control, with support for extensions, customization, and modern web standards across desktop and mobile devices.""",https://www.mozilla.org/firefox/,https://github.com/mozilla/gecko-dev/,MPL,linux|macos|windows|android|ios,cross-platform|privacy-focused|customizable|extensible|plugin-based|no-tracking,beginner,FALSE,2002
signal,Signal,Privacy,messaging,"""Messaging application for secure communication, offering end-to-end encrypted text, voice, and video with support for private group conversations.""",https://signal.org/,https://github.com/signalapp/,AGPL,android|ios|linux|macos|windows,cross-platform|real-time|encrypted|end-to-end-encryption|privacy-focused|multi-user|no-tracking,beginner,FALSE,2014
tor-browser,Tor Browser,Privacy,browsers,"""Privacy-focused web browser that routes traffic through the Tor network to anonymize browsing activity and protect against tracking and surveillance.""",https://www.torproject.org/,https://github.com/torproject/tor-browser/,MIT,linux|macos|windows|android,cross-platform|privacy-focused|anonymous|no-tracking,beginner,FALSE,2008
docker,Docker,Development,devops,"""Containerization platform for building, packaging, and running applications in isolated environments, enabling consistent deployment across systems.""",https://www.docker.com/,https://github.com/docker/,Apache,web|linux|macos|windows,cross-platform|cli|api|automation|advanced-users,intermediate,FALSE,2013
git,Git,Development,version-control|collaboration,"""Distributed version control system for tracking changes in source code, enabling branching, merging, and collaboration across development workflows.""",https://git-scm.com/,https://github.com/git/git/,GPL,linux|macos|windows,cross-platform|cli|advanced-users|version-control,intermediate,FALSE,2005
gitlab,GitLab,Development,version-control|collaboration|devops,"""Platform for managing source code repositories, CI/CD pipelines, and project collaboration, available as both a hosted service and self-hosted solution.""",https://about.gitlab.com/,https://github.com/gitlabhq/gitlabhq/,MIT,web|linux,self-hosted|cloud|multi-user|collaborative|api|customizable|version-control,intermediate,TRUE,2011
gitea,Gitea,Development,version-control|collaboration,"""Lightweight Git hosting service for managing repositories, issues, and collaboration workflows, designed for easy self-hosted deployment.""",https://gitea.io/,https://github.com/go-gitea/gitea/,MIT,web|linux|macos|windows,self-hosted|multi-user|collaborative|lightweight|customizable|version-control,beginner,TRUE,2016
kdenlive,Kdenlive,Media,video-editing,"""Non-linear video editor for creating and editing video projects with timeline-based workflows, effects, transitions, and multi-track support.""",https://kdenlive.org/,https://github.com/KDE/kdenlive/,GPL,linux|macos|windows,cross-platform|offline-capable|customizable|advanced-users,intermediate,FALSE,2003
handbrake,HandBrake,Media,video-editing|data-processing|compression,"""Video transcoder for converting media files between formats, with controls for compression, codecs, and output optimization.""",https://handbrake.fr/,https://github.com/HandBrake/HandBrake/,GPL,linux|macos|windows,cross-platform|offline-capable|customizable,beginner,FALSE,2003
darktable,Darktable,Design,image-editing,"""Photo processing application for managing and editing raw images with non-destructive workflows, color correction tools, and advanced photographic controls.""",https://www.darktable.org/,https://github.com/darktable-org/darktable/,GPL,linux|macos|windows,cross-platform|offline-capable|advanced-users|customizable,intermediate,FALSE,2009
neovim,Neovim,Development,code-editing,"""Text editor designed for extensibility and keyboard-driven workflows, offering modernized Vim features with support for plugins, scripting, and customization.""",https://neovim.io/,https://github.com/neovim/neovim/,Apache,linux|macos|windows,cross-platform|cli|extensible|customizable|advanced-users,advanced,FALSE,2014
home-assistant,Home Assistant,Utilities,system-tools|ai-automation|network-communication,"""Home automation platform for controlling smart devices, automating routines, and integrating services across a locally hosted environment.""",https://www.home-assistant.io/,https://github.com/home-assistant/core/,Apache,linux|macos|windows|web,self-hosted|automation|api|extensible|customizable|multi-user,intermediate,TRUE,2013
jellyfin,Jellyfin,Media,media-players|streaming,"""Media server for organizing, streaming, and accessing video, music, and other content across devices with user accounts and library management features.""",https://jellyfin.org/,https://github.com/jellyfin/jellyfin/,GPL,linux|macos|windows|android|ios|web,self-hosted|library-management|synchronization|multi-user|cross-platform|no-tracking,beginner,TRUE,2018
transmission,Transmission,Networking,network-communication,"""BitTorrent client focused on simplicity and efficiency, offering downloading, seeding, and remote management with a minimal interface.""",https://transmissionbt.com/,https://github.com/transmission/transmission/,GPL,linux|macos|windows,cross-platform|offline-capable|lightweight|customizable,beginner,FALSE,2005
calibre,Calibre,Media,media-players|document-editing|file-management,"""Ebook management software for organizing, converting, and reading digital books, with support for metadata editing and device syncing.""",https://calibre-ebook.com/,https://github.com/kovidgoyal/calibre/,GPL,linux|macos|windows,cross-platform|offline-capable|library-management|customizable,beginner,FALSE,2006
gparted,GParted,Utilities,system-tools,"""Disk partition editor for creating, resizing, and managing storage partitions, commonly used for system setup and maintenance tasks.""",https://gparted.org/,https://github.com/GNOME/gparted/,GPL,linux,offline-capable|advanced-users,intermediate,FALSE,2004
nixos,NixOS,Utilities,system-tools,"""Linux distribution built around declarative configuration, allowing users to define system state reproducibly with version-controlled configuration files.""",https://nixos.org/,https://github.com/NixOS/nixpkgs/,MIT,linux,customizable|advanced-users,advanced,FALSE,2003
homebrew,Homebrew,Development,package-management,"""Package manager for installing and managing software on macOS and Linux systems through a command-line interface and formula-based system.""",https://brew.sh/,https://github.com/Homebrew/brew/,BSD,linux|macos,cli|cross-platform|automation|advanced-users,beginner,FALSE,2009
logseq,Logseq,Productivity,note-taking|knowledge-base,"""Knowledge management and note-taking app that organizes information using linked pages and local files, with support for outlining and bidirectional links.""",https://logseq.com/,https://github.com/logseq/logseq/,AGPL,linux|macos|windows|android|ios,cross-platform|local-first|knowledge-management|offline-capable|customizable,beginner,FALSE,2020
frigate,Frigate,Utilities,system-tools|ai-automation|network-communication,"""Video surveillance system that uses object detection to monitor camera feeds, providing real-time alerts and event recording optimized for local deployment.""",https://frigate.video/,https://github.com/blakeblackshear/frigate/,MIT,linux|web,self-hosted|real-time|multi-user|api,advanced,TRUE,2020
matomo,Matomo,Data,analytics,"""Web analytics platform for tracking website traffic and user behavior, offering detailed reports and dashboards while keeping data under user control.""",https://matomo.org/,https://github.com/matomo-org/matomo/,GPL,web|linux,self-hosted|api|privacy-focused|customizable,intermediate,TRUE,2007
postgresql,PostgreSQL,Data,databases,"""Relational database system for storing and querying structured data, supporting advanced indexing, transactions, and extensible data types.""",https://www.postgresql.org/,https://github.com/postgres/postgres/,PostgreSQL,linux|macos|windows,cross-platform|api|advanced-users|database,advanced,FALSE,1996
pgadmin,pgAdmin,Data,databases,"""Graphical interface for managing PostgreSQL databases, providing tools for query execution, database design, and administration.""",https://www.pgadmin.org/,https://github.com/pgadmin-org/pgadmin4/,PostgreSQL,web|linux|macos|windows,cross-platform|api|multi-user|customizable|database,intermediate,FALSE,2002
dbeaver,DBeaver Community,Data,databases,"""Database management tool for working with SQL databases, offering query editing, data visualization, and support for multiple database systems.""",https://dbeaver.io/,https://github.com/dbeaver/dbeaver/,Apache,linux|macos|windows,cross-platform|api|customizable|advanced-users|database,beginner,FALSE,2011
grafana,Grafana,Data,data-visualization,"""Visualization platform for building dashboards and monitoring data from multiple sources, with support for real-time metrics and alerting.""",https://grafana.com/,https://github.com/grafana/grafana/,AGPL,web|linux|macos|windows,self-hosted|api|customizable|multi-user|monitoring,intermediate,TRUE,2014
prometheus,Prometheus,Data,data-processing|analytics,"""Monitoring and alerting system that collects time-series metrics from services and provides querying, visualization, and alerting capabilities.""",https://prometheus.io/,https://github.com/prometheus/prometheus/,Apache,linux|macos|windows,self-hosted|api|advanced-users|monitoring,advanced,TRUE,2014
kicad,KiCad,Design,vector-graphics|3d-modeling,"""Electronic design automation suite for creating schematics and printed circuit board layouts, with tools for simulation and manufacturing preparation.""",https://www.kicad.org/,https://github.com/KiCad/kicad-source-mirror/,GPL,linux|macos|windows,cross-platform|offline-capable|customizable|advanced-users,advanced,FALSE,1992
rawtherapee,RawTherapee,Design,image-editing,"""Photo editing software for processing raw images with non-destructive adjustments, advanced color correction, and detailed image control.""",https://rawtherapee.com/,https://github.com/Beep6581/RawTherapee/,GPL,linux|macos|windows,cross-platform|offline-capable|advanced-users|customizable,intermediate,FALSE,2010
prusaslicer,PrusaSlicer,Utilities,system-tools|3d-modeling,"""3D printing slicer for preparing models for printing, generating toolpaths, and configuring printer settings for different materials and hardware.""",https://www.prusa3d.com/prusaslicer/,https://github.com/prusa3d/PrusaSlicer/,AGPL,linux|macos|windows,cross-platform|offline-capable|customizable|advanced-users,intermediate,FALSE,2019
zotero,Zotero,Productivity,knowledge-base,"""Research and reference management tool for collecting, organizing, citing, and sharing sources, with browser integration and syncing across devices.""",https://www.zotero.org/,https://github.com/zotero/zotero/,AGPL,linux|macos|windows|ios,cross-platform|offline-capable|synchronization|organization|multi-user,beginner,FALSE,2006
beekeeper-studio,Beekeeper Studio,Data,databases,"""Database client for querying and managing SQL databases, with features for editing data, running queries, and organizing connections in a user-friendly interface.""",https://www.beekeeperstudio.io/,https://github.com/beekeeper-studio/beekeeper-studio/,GPL,linux|macos|windows,cross-platform|offline-capable|customizable|advanced-users|database,beginner,FALSE,2020
immich,Immich,Privacy,file-storage|image-editing,"""Self-hosted photo and video management platform with automatic backups, timeline browsing, and mobile apps for syncing and viewing media.""",https://immich.app/,https://github.com/immich-app/immich/,AGPL,web|linux|macos|windows|android|ios,self-hosted|synchronization|multi-user|library-management|api|file-management,beginner,TRUE,2022
photoprism,PhotoPrism,Privacy,file-storage|image-editing,"""Photo management application for organizing, browsing, and searching large image collections, with features like tagging, metadata analysis, and face recognition.""",https://www.photoprism.app/,https://github.com/photoprism/photoprism/,AGPL,web|linux|macos|windows,self-hosted|library-management|synchronization|multi-user|api|privacy-focused|file-management,intermediate,TRUE,2022
digikam,digiKam,Design,file-storage|image-editing,"""Photo management software for organizing, tagging, and editing large collections of images, with support for metadata, batch processing, and advanced workflows.""s",https://www.digikam.org/,https://github.com/KDE/digikam/,GPL,linux|macos|windows,cross-platform|offline-capable|library-management|customizable|advanced-users,intermediate,FALSE,2009
jan,Jan,AI,llm-tools|local-ai,"""Desktop application for running and interacting with language models locally, providing a private chat interface without requiring cloud services.""",https://jan.ai/,https://github.com/janhq/jan/,AGPL,linux|macos|windows,cross-platform|offline-capable|local-first|privacy-focused,beginner,FALSE,2024
gpt4all,GPT4All,AI,llm-tools|local-ai,"""Local language model platform for running AI models on personal devices, enabling offline chat, text generation, and experimentation.""",https://gpt4all.io/,https://github.com/nomic-ai/gpt4all/,MIT,linux|macos|windows,cross-platform|offline-capable|local-first|privacy-focused|llm,beginner,FALSE,2023
librechat,LibreChat,AI,llm-tools,"""Self-hosted chat interface for interacting with language models, supporting multiple providers, conversation management, and extensible integrations.""",https://www.librechat.ai/,https://github.com/danny-avila/LibreChat/,MIT,web|linux|macos|windows,self-hosted|multi-user|api|llm|customizable,intermediate,TRUE,2023
comfyui,ComfyUI,AI,image-generation|local-ai,"""Node-based interface for building and running image generation workflows, allowing users to visually compose pipelines for generative models.""",https://github.com/comfy-org/ComfyUI/,https://github.com/comfy-org/ComfyUI/,GPL,linux|macos|windows,cross-platform|offline-capable|extensible|customizable|advanced-users,advanced,FALSE,2023
invokeai,InvokeAI,AI,image-generation|local-ai,"""Image generation tool for creating and editing visuals using generative models, with controls for prompts, styles, and iterative refinement.""",https://github.com/invoke-ai/InvokeAI/,https://github.com/invoke-ai/InvokeAI/,Apache,linux|macos|windows,cross-platform|offline-capable|customizable|advanced-users,intermediate,FALSE,2022
librelingo,LibreLingo,Education,language-learning|interactive-learning,"""Language learning platform that provides interactive lessons and exercises for practicing vocabulary, grammar, and comprehension.""",https://librelingo.app/,https://github.com/LibreLingoCommunity/LibreLingo/,AGPL,web,cross-platform|offline-capable|beginner-friendly,beginner,FALSE,2020
lwt,Learning With Texts,Education,language-learning|knowledge-base,"""Language learning system that helps users read and analyze texts by tracking vocabulary, translations, and progress over time.""",https://github.com/HugoFara/lwt/,https://github.com/HugoFara/lwt/,GPL,web,self-hosted|multi-user,intermediate,TRUE,2011
anki,Anki,Education,learning,"""Flashcard-based learning tool that uses spaced repetition to help users memorize information efficiently across a wide range of subjects.""",https://apps.ankiweb.net/,https://github.com/ankitects/anki/,AGPL,linux|macos|windows,cross-platform|offline-capable|synchronization|local-first|beginner-friendly,beginner,FALSE,2006
