id,name,category,subcategory,description,website,github,license,platforms,tags,difficulty,self_hosted,year_started
signal,Signal,Privacy,messaging,"Open source secure messaging app with end-to-end encryption for private communication",https://signal.org/,https://github.com/signalapp,AGPL,android|ios|linux|macos|windows,secure-messaging|end-to-end-encryption|privacy-focused|cross-platform,beginner,false,2014
tor-browser,Tor Browser,Privacy,browsers,"Open source browser for anonymous web browsing through the Tor network",https://www.torproject.org/,https://github.com/torproject/tor-browser,MIT,linux|macos|windows|android,privacy-focused|anonymous|web,beginner,false,2008
docker,Docker,Development,devops,"Open source platform for building, shipping, and running applications in containers",https://www.docker.com/,https://github.com/docker,Apache,linux|macos|windows|web,cli|api|automation|cross-platform,intermediate,false,2013
git,Git,Development,version-control,"Distributed version control system for tracking changes in source code",https://git-scm.com/,https://github.com/git/git,GPL,linux|macos|windows,cli|cross-platform,intermediate,false,2005
gitlab,GitLab,Development,devops,"Open source DevOps platform for source code management, CI/CD, and collaboration",https://about.gitlab.com/,https://github.com/gitlabhq/gitlabhq,MIT,web|linux,self-hosted|collaborative|automation,intermediate,true,2011
gitea,Gitea,Development,version-control,"Lightweight self-hosted Git service for managing repositories and collaboration",https://gitea.io/,https://github.com/go-gitea/gitea,MIT,web|linux|macos|windows,self-hosted|lightweight|collaborative,beginner,true,2016
kdenlive,Kdenlive,Media,video-editing,"Open source non-linear video editor with multi-track editing and effects",https://kdenlive.org/,https://github.com/KDE/kdenlive,GPL,linux|macos|windows,video-editing|cross-platform|offline-capable,intermediate,false,2003
handbrake,HandBrake,Media,video-editing,"Open source video transcoder for converting video formats",https://handbrake.fr/,https://github.com/HandBrake/HandBrake,GPL,linux|macos|windows,video-editing|cross-platform|offline-capable,beginner,false,2003
darktable,Darktable,Design,image-editing,"Open source photography workflow application and raw image editor",https://www.darktable.org/,https://github.com/darktable-org/darktable,GPL,linux|macos|windows,image-editing|cross-platform|offline-capable,intermediate,false,2009
neovim,Neovim,Development,code-editing,"Modernized Vim-based text editor",https://neovim.io/,https://github.com/neovim/neovim,Apache,linux|macos|windows,cli|extensible|lightweight,advanced,false,2014
