id,name,category,subcategory,description,website,github,license,platforms,tags,difficulty,self_hosted,year_started
gimp,GIMP,Design,image-editing,"Open source image editor similar to Photoshop",https://gimp.org/,https://github.com/GNOME/gimp,GPL,linux|macos|windows,cross-platform|image-editing,intermediate,false,1996
blender,Blender,Design,3d-modeling,"Open source 3D modeling and animation suite",https://blender.org/,https://github.com/blender/blender,GPL,linux|macos|windows,cross-platform|3d-modeling|animation,advanced,false,1998
obs,OBS Studio,Media,streaming,"Open source video recording and live streaming software",https://obsproject.com/,https://github.com/obsproject/obs-studio,GPL,linux|macos|windows,cross-platform|streaming|screen-recording,intermediate,false,2012
libreoffice,LibreOffice,Productivity,document-editing,"Open source office suite for documents, spreadsheets, and presentations",https://www.libreoffice.org/,https://github.com/LibreOffice/core,MPL,linux|macos|windows,cross-platform|offline-capable|beginner-friendly|document-editing|spreadsheet-editing|presentation-editing,beginner,false,2010
keepassxc,KeePassXC,Security,password-managers,"Open source password manager for securely storing credentials locally",https://keepassxc.org/,https://github.com/keepassxreboot/keepassxc,GPL,linux|macos|windows,cross-platform|encrypted|offline-capable|privacy-focused|password-manager,intermediate,false,2017
languagetool,LanguageTool,Productivity,document-editing,"Open source grammar and spell checker supporting multiple languages",https://languagetool.org/,https://github.com/languagetool-org/languagetool,LGPL,web|linux|macos|windows,api|document-editing|cross-platform,beginner,true,2005
latex-gboard-dictionary,LaTeX Gboard Dictionary,Utilities,system-tools,"Custom dictionary enabling LaTeX input support on Gboard",https://github.com/DenverCoder1/LaTeX-Gboard-Dictionary/,https://github.com/DenverCoder1/LaTeX-Gboard-Dictionary,MIT,android,lightweight|cli|local-first,advanced,false,2021
owncast,Owncast,Media,streaming,"Self-hosted live streaming server for broadcasting video content",https://owncast.online/,https://github.com/owncast/owncast,MIT,web|linux|macos|windows,self-hosted|streaming|real-time|privacy-focused,intermediate,true,2020
vlc,VLC Media Player,Media,media-players,"Open source media player supporting most audio and video formats",https://www.videolan.org/vlc/,https://github.com/videolan/vlc,LGPL,linux|macos|windows|android|ios,media-player|cross-platform|offline-capable,beginner,false,2001
shotcut,Shotcut,Media,video-editing,"Open source video editor with support for a wide range of formats",https://shotcut.org/,https://github.com/mltframework/shotcut,GPL,linux|macos|windows,video-editing|cross-platform|offline-capable,intermediate,false,2004
audacity,Audacity,Media,audio-editing,"Open source audio editor and recorder for multi-track editing",https://www.audacityteam.org/,https://github.com/audacity/audacity,GPL,linux|macos|windows,audio-editing|cross-platform|offline-capable,beginner,false,2000
brave,Brave Browser,Privacy,browsers,"Privacy-focused web browser with built-in ad blocking and tracking protection",https://brave.com/,https://github.com/brave/brave-browser,MPL,linux|macos|windows|android|ios,privacy-focused|no-tracking|web|cross-platform,beginner,false,2016
filezilla,FileZilla,Networking,servers,"Open source FTP client for transferring files between local and remote systems",https://filezilla-project.org/,https://github.com/filezilla/filezilla,GPL,linux|macos|windows,file-management|cross-platform,intermediate,false,2001
thunderbird,Thunderbird,Privacy,email,"Open source email client developed by Mozilla",https://www.thunderbird.net/,https://github.com/mozilla/releases-comm-central,MPL,linux|macos|windows,email|cross-platform|offline-capable|privacy-focused,beginner,false,2003
internxt,Internxt,Privacy,file-storage,"Privacy-focused cloud storage service with end-to-end encryption",https://internxt.com/,https://github.com/internxt,AGPL,web|linux|macos|windows|android|ios,cloud|encrypted|privacy-focused|file-management|cross-platform,beginner,false,2020
simplescreenrecorder,SimpleScreenRecorder,Media,screen-recording,"Lightweight screen recording software for Linux systems",https://www.maartenbaert.be/simplescreenrecorder/,https://github.com/MaartenBaert/ssr,GPL,linux,screen-recording|lightweight|offline-capable,beginner,false,2012
jaspersoft,Jaspersoft Community,Data,data-visualization,"Open source business intelligence and reporting platform",https://community.jaspersoft.com/,https://github.com/TIBCOSoftware/jasperreports,AGPL,web,data-visualization,advanced,true,2005
vscode,Visual Studio Code,Development,code-editing,"Popular open source code editor with extensive extension support",https://code.visualstudio.com/,https://github.com/microsoft/vscode,MIT,linux|macos|windows,extensible|plugin-based|cross-platform,beginner,false,2015
tuxguitar,TuxGuitar,Media,music-production,"Open source guitar tablature editor and player",https://sourceforge.net/projects/tuxguitar/,https://github.com/TuxGuitar/TuxGuitar,LGPL,linux|macos|windows,music-production|media-player|offline-capable,intermediate,false,2008
jitsi,Jitsi,Networking,network-communication,"Open source video conferencing platform for secure communication",https://jitsi.org/,https://github.com/jitsi,Apache,web|linux|macos|windows|android|ios,real-time|secure-messaging|privacy-focused|cross-platform,beginner,true,2003
gcompris,GCompris,Education,interactive-learning,"Open source educational software suite with interactive learning activities for children",https://gcompris.net/index-en.html,https://github.com/gcompris/GCompris-qt,GPL,linux|macos|windows|android,education|interactive-learning|beginner-friendly,beginner,false,2000
freecad,FreeCAD,Design,3d-modeling,"Parametric open source 3D CAD modeling software",https://www.freecadweb.org/,https://github.com/FreeCAD/FreeCAD,LGPL,linux|macos|windows,3d-modeling|offline-capable,advanced,false,2001
owncloud,ownCloud,Privacy,file-storage,"Self-hosted file storage and sharing platform for secure data management",https://www.owncloud.com/,https://github.com/owncloud/core,AGPL,web|linux|macos|windows,self-hosted|file-management|privacy-focused|cloud,intermediate,true,2010
mediawiki,MediaWiki,Productivity,knowledge-base,"Open source wiki platform for collaborative documentation and knowledge sharing",https://www.mediawiki.org/wiki/MediaWiki,https://github.com/wikimedia/mediawiki,GPL,web,self-hosted|collaborative|knowledge-base|extensible,intermediate,true,2003
bleachbit,BleachBit,Utilities,system-tools,"Open source system cleaner for freeing disk space and removing unwanted data",https://www.bleachbit.org/,https://github.com/bleachbit/bleachbit,GPL,linux|windows,lightweight|offline-capable|privacy-focused,beginner,false,2008
codemirror,CodeMirror,Development,code-editing,"Open source code editor component for the web with syntax highlighting and extension support",https://codemirror.net/,https://github.com/codemirror/dev,MIT,web,web|extensible|api,advanced,false,2007
gnu-health,GNU Health,Productivity,collaboration,"Open source health and hospital information system for managing clinical and administrative workflows",https://www.gnuhealth.org/,https://github.com/msuarez/gnuhealth,GPL,web|linux|macos,self-hosted|collaborative|privacy-focused,advanced,true,2008
ocs-inventory-ng,OCS Inventory NG,Utilities,system-tools,"Open source asset management and deployment platform for inventorying computers, software, and networked devices",https://ocsinventory-ng.org/,https://github.com/ocsinventory-ng,GPL,web|linux|macos|windows|android,self-hosted|automation|api,advanced,true,2001
glpi,GLPI,Utilities,system-tools,"Open source IT service management and asset tracking platform",https://www.glpi-project.org/en/,https://github.com/glpi-project/glpi,GPL,web,self-hosted|collaborative|automation,advanced,true,2003
ampache,Ampache,Media,streaming,"Open source web-based audio and video streaming application with file management features",https://ampache.org/,https://github.com/ampache/ampache,AGPL,web,self-hosted|streaming|media-player|file-management,intermediate,true,2001
unicenta-opos,uniCenta oPOS,Productivity,collaboration,"Open source point-of-sale software for retail and hospitality",https://unicenta.com/,https://github.com/herbiehp/unicenta,GPL,linux|macos|windows,self-hosted|collaborative,advanced,true,2010
openshot,OpenShot,Media,video-editing,"Open source video editor for Linux, macOS, and Windows",https://www.openshot.org/,https://github.com/OpenShot/openshot-qt,GPL,linux|macos|windows,video-editing|cross-platform|offline-capable|beginner-friendly,beginner,false,2008
lan-messenger,LAN Messenger,Networking,network-communication,"Open source local network instant messenger with file transfer and no server requirement",https://lanmsngr.sourceforge.net/index.php,https://github.com/lanmessenger/lanmessenger,GPL,linux|macos|windows,real-time|lightweight|cross-platform|file-management,beginner,false,2007
cherrytree,CherryTree,Productivity,note-taking,"Open source hierarchical note-taking application with rich text and syntax highlighting",https://www.giuspen.net/cherrytree/,https://github.com/giuspen/cherrytree,GPL,linux|windows,note-taking|knowledge-base|offline-capable,beginner,false,2009
flightgear,FlightGear,Education,learning,"Open source flight simulator used by enthusiasts, researchers, and training organizations",https://www.flightgear.org/,https://github.com/FlightGear/flightgear,GPL,linux|macos|windows,education|cross-platform,advanced,false,1997
musescore,MuseScore,Media,music-production,"Open source music notation and composition software",https://musescore.org/en,https://github.com/musescore/MuseScore,GPL,linux|macos|windows,music-production|offline-capable|beginner-friendly,beginner,false,2002
tmux,tmux,Utilities,terminal,"Open source terminal multiplexer for managing multiple terminal sessions",https://github.com/tmux/tmux/wiki,https://github.com/tmux/tmux,ISC,linux|macos,cli|lightweight,intermediate,false,2007
qbittorrent,qBittorrent,Networking,network-communication,"Open source BitTorrent client for major desktop platforms",https://www.qbittorrent.org/,https://github.com/qbittorrent/qBittorrent,GPL,linux|macos|windows,cross-platform|lightweight,beginner,false,2006
nextcloud,Nextcloud,Privacy,file-storage,"Open source self-hosted file sync, sharing, and collaboration platform",https://nextcloud.com/,https://github.com/nextcloud/server,AGPL,web|linux|macos|windows|android|ios,self-hosted|cloud|privacy-focused|file-management|collaborative,intermediate,true,2016
celestia,Celestia,Education,learning,"Open source 3D astronomy and space simulation software",https://celestiaproject.space/,https://github.com/CelestiaProject/Celestia,GPL,linux|macos|windows,cross-platform|education|offline-capable,beginner,false,2001
freerdp,FreeRDP,Networking,remote-access,"Open source implementation of the Remote Desktop Protocol with client and library support",https://www.freerdp.com/,https://github.com/FreeRDP/FreeRDP,Apache,linux|macos|windows|android|ios,cross-platform|api|remote-access,advanced,false,2012
flyspray,Flyspray,Development,testing,"Open source web-based bug and task tracking system",https://github.com/flyspray/flyspray,https://github.com/flyspray/flyspray,LGPL,web,self-hosted|collaborative,intermediate,true,2005
gnucash,GnuCash,Productivity,document-editing,"Open source financial accounting software for personal and small-business use",https://www.gnucash.org/,https://github.com/Gnucash/gnucash,GPL,linux|macos|windows,cross-platform|offline-capable,intermediate,false,1998
logicaldoc,LogicalDOC,Productivity,knowledge-base,"Open source document management platform for storing, organizing, and collaborating on files",https://www.logicaldoc.us/,https://github.com/logicaldoc/community,LGPL,web,self-hosted|collaborative|knowledge-base|file-management,intermediate,true,2008
dvdstyler,DVDStyler,Media,video-editing,"Open source DVD authoring application for creating interactive video DVDs",https://www.dvdstyler.org/en/,https://sourceforge.net/p/dvdstyler/DVDStyler/ci/master/tree/,GPL,linux|macos|windows,video-editing|offline-capable|cross-platform,intermediate,false,2003
osquery,osquery,Security,auditing,"Open source operating system instrumentation and analytics framework using SQL-based queries",https://osquery.io/,https://github.com/osquery/osquery,Apache OR GPL,linux|macos|windows,cli|api|lightweight,advanced,false,2014
keepass,KeePass,Security,password-managers,"Open source password manager that stores credentials in an encrypted local database",https://keepass.info/,,GPL,linux|macos|windows,encrypted|offline-capable|privacy-focused|password-manager,intermediate,false,2003
pdf-mix-tool,PDF Mix Tool,Utilities,file-management,"Open source PDF utility for splitting, merging, rotating, and rearranging PDF pages",https://scarpetta.eu/pdfmixtool/,https://gitlab.com/scarpetta/pdfmixtool,GPL,linux,lightweight|offline-capable|file-management,beginner,false,2018
mailspring,Mailspring,Privacy,email,"Open source email client for desktop platforms with extension support and unified inbox features",https://www.getmailspring.com/,https://github.com/Foundry376/Mailspring,GPL,linux|macos|windows,email|extensible|cross-platform,beginner,false,2017
opentodolist,OpenToDoList,Productivity,task-management,"Open source to-do list and note-taking app for desktop and mobile devices",https://opentodolist.rpdev.net/,https://github.com/mhoeher/opentodolist,Apache,linux|macos|windows|android|ios,note-taking|task-management|local-first|cross-platform,beginner,false,2013
onlyoffice,ONLYOFFICE,Productivity,document-editing,"Open source office suite for editing documents, spreadsheets, and presentations",https://www.onlyoffice.com/,https://github.com/ONLYOFFICE/DesktopEditors,AGPL,linux|macos|windows|android|ios,document-editing|spreadsheet-editing|presentation-editing|cross-platform,beginner,false,2009
cmu-sphinx,CMU Sphinx,AI,local-ai,"Open source speech recognition toolkit for mobile and server applications",https://cmusphinx.github.io/,https://github.com/cmusphinx, BSD,web|linux|macos|windows|android|ios,api|speech-to-text|cross-platform,advanced,false,2000
emacspeak,Emacspeak,Utilities,system-tools,"Open source speech interface for Emacs designed to improve desktop accessibility",http://emacspeak.sourceforge.net/,,GPL,linux|windows,text-to-speech|cli|accessibility,advanced,false,1995
espeak-ng,eSpeak NG,Utilities,system-tools,"Open source text-to-speech engine supporting many languages and platforms",https://github.com/espeak-ng/espeak-ng,https://github.com/espeak-ng/espeak-ng,GPL,linux|macos|windows|android,text-to-speech|lightweight|cross-platform,intermediate,false,2016
festival,Festival Speech Synthesis System,Utilities,system-tools,"Open source multilingual speech synthesis system for text-to-speech applications",https://www.cstr.ed.ac.uk/projects/festival/,https://github.com/festvox/festival,X11,linux|macos|windows,text-to-speech|api|cross-platform,advanced,false,1999
marf,Modular Audio Recognition Framework,AI,model-management,"Open source framework for audio, speech, and text analysis and recognition",https://marf.sourceforge.net/,https://github.com/activityworkshop/MARF,BSD,linux|macos|windows,api|speech-to-text|cross-platform,advanced,false,2002
nvda,NVDA,Utilities,system-tools,"Open source screen reader for blind and vision-impaired users on Windows",https://www.nvaccess.org/about-nvda/,https://github.com/nvaccess/nvda,GPL,windows,text-to-speech|beginner-friendly,beginner,false,2006
text2speech,Text2Speech,Utilities,system-tools,"Open source text-to-speech desktop application written in C#",https://sourceforge.net/projects/text2speech/, ,GPL,windows,text-to-speech|lightweight,beginner,false,2013
dasher,Dasher,Utilities,system-tools,"Open source predictive text-entry system designed for accessibility and alternative input",https://dasher.at/downloads/,https://github.com/dasher-project/dasher,GPL,linux|windows,cross-platform|beginner-friendly,intermediate,false,1997
virtual-magnifying-glass,Virtual Magnifying Glass,Utilities,system-tools,"Open source screen magnifier for improving on-screen readability",https://magnifier.sourceforge.net/,,GPL,linux|macos|windows,cross-platform|beginner-friendly,beginner,false,2005
bali-phy,BAli-Phy,Data,data-processing,"Open source Bayesian software for joint sequence alignment and phylogenetic inference",https://www.bali-phy.org/,https://github.com/bredelings/BAli-Phy,GPL,linux|macos|windows,cli,advanced,false,2006
blast,BLAST,Data,data-processing,"Public-domain sequence search software for comparing nucleotide and protein sequences",https://blast.ncbi.nlm.nih.gov/Blast.cgi,https://github.com/ncbi/ncbi-cxx-toolkit-public,Public Domain,web|linux|macos|windows,api,advanced,false,1990
bowtie,Bowtie,Data,data-processing,"Open source ultrafast aligner for short DNA sequencing reads",http://bowtie-bio.sourceforge.net/index.shtml,https://github.com/BenLangmead/bowtie,Artistic-2.0,linux|macos|windows,cli|lightweight,advanced,false,2009
clustal-omega,Clustal Omega,Data,data-processing,"Open source multiple sequence alignment software for protein and DNA/RNA sequences",http://www.clustal.org/,https://github.com/GSLBiotech/clustal-omega,GPL,linux|macos|windows,cli,advanced,false,2011
decipher,DECIPHER,Data,data-processing,"Open source R package for analyzing and managing biological sequences",https://decipher.codes/,https://github.com/erikwright/DECIPHER,GPL,linux|macos|windows,api,advanced,false,2014
fasta,FASTA,Data,data-processing,"Open source package for biological sequence similarity searching and alignment",http://fasta.bioch.virginia.edu/,https://github.com/wrpearson/fasta36,Apache,linux|macos|windows,cli,advanced,false,1985
fsa,Fast Statistical Alignment,Data,data-processing,"Open source probabilistic multiple sequence alignment software for DNA, RNA, and protein sequences",http://fsa.sourceforge.net/,,GPL,linux|macos,cli,advanced,false,2009
hmmer,HMMER,Data,data-processing,"Open source software suite for sequence analysis using profile hidden Markov models",https://hmmer.org/, ,BSD,linux|macos|windows,cli|data-processing,advanced,false,1998
hh-suite,HH-suite,Data,data-processing,"Open source software suite for sensitive protein sequence searching and alignment",https://github.com/soedinglab/hh-suite,https://github.com/soedinglab/hh-suite,GPL,linux,cli|data-processing,advanced,false,2005
jaligner,JAligner,Data,data-processing,"Open source Java library for pairwise sequence alignment",http://jaligner.sourceforge.net/, ,GPL,linux|macos|windows,api|data-processing,advanced,false,2014
mafft,MAFFT,Data,data-processing,"Open source multiple sequence alignment software for nucleotide and protein sequences",https://mafft.cbrc.jp/alignment/software/, ,BSD,linux|macos,cli|data-processing,advanced,false,2002
muscle,MUSCLE,Data,data-processing,"Open source multiple sequence alignment software for biological sequences",https://drive5.com/muscle/, ,GPL,linux|macos|windows,cli|data-processing,advanced,false,2004
nextflow,Nextflow,Development,devops,"Open source workflow orchestration framework for reproducible and scalable data pipelines",https://www.nextflow.io/,https://github.com/nextflow-io/nextflow,Apache,linux|macos|windows|web,cli|api|automation|cross-platform,advanced,false,2013
phyloscan,Phyloscan,Data,data-processing,"Open source toolkit for phylogenetic analysis of biological sequence data",http://zlab.bu.edu/phyloscan/,https://github.com/bpt26/phyloScan,GPL,linux,cli|data-processing,advanced,false,2005
probalign,Probalign,Data,data-processing,"Open source software for probabilistic multiple sequence alignment",http://probalign.njit.edu/, ,GPL,linux,cli|data-processing,advanced,false,2006
probcons,ProbCons,Data,data-processing,"Open source tool for probabilistic multiple sequence alignment of protein sequences",http://probcons.stanford.edu/, ,GPL,linux|macos|windows,cli|data-processing,advanced,false,2005
stemloc,Stemloc,Data,data-processing,"Open source software for RNA sequence alignment with secondary structure modeling",http://biowiki.org/StemLoc, ,GPL,linux,cli|data-processing,advanced,false,2004
t-coffee,T-Coffee,Data,data-processing,"Open source multiple sequence alignment software for biological sequences",https://tcoffee.crg.eu/,,GPL,web|linux|macos|windows,cli|data-processing,advanced,false,2000
ugene,UGENE,Data,data-processing,"Open source bioinformatics software for sequence analysis and visualization",https://ugene.net/,https://github.com/ugeneunipro/ugene,GPL,linux|macos|windows,cross-platform|data-processing,advanced,false,2008
yass,YASS,Data,data-processing,"Open source DNA similarity search tool for genomic sequence comparison",http://bioinfo.lifl.fr/yass/,,GPL,linux,cli|data-processing,advanced,false,2005
librecad,LibreCAD,Design,vector-graphics,"Open source 2D CAD application for technical drawing and drafting",https://librecad.org/,,LGPL,linux|macos|windows,cross-platform|vector-graphics,intermediate,false,2010
solvespace,SolveSpace,Design,3d-modeling,"Open source parametric 2D and 3D CAD software for modeling and mechanical design",https://solvespace.com/,,GPL,linux|macos|windows,cross-platform|3d-modeling,advanced,false,2008
brl-cad,BRL-CAD,Design,3d-modeling,"Open source solid modeling system for CAD, analysis, and visualization",https://brlcad.org/,,LGPL,linux|macos|windows,cross-platform|3d-modeling,advanced,false,1984
openscad,OpenSCAD,Design,3d-modeling,"Open source script-based 3D CAD modeler for creating solid objects",https://openscad.org/,https://github.com/openscad/openscad,GPL,linux|macos|windows,cross-platform|3d-modeling,advanced,false,2011
occt,Open Cascade Technology (OCCT),Development,api-tools,"Open source 3D modeling and CAD development platform delivered as C++ libraries",https://www.opencascade.com/open-cascade-technology/,https://github.com/Open-Cascade-SAS/OCCT,LGPL,linux|macos|windows,api|cross-platform|3d-modeling,advanced,false,1999
wings3d,Wings 3D,Design,3d-modeling,"Open source subdivision modeler for creating and editing 3D geometry",http://www.wings3d.com/,,BSD,linux|macos|windows,cross-platform|3d-modeling,intermediate,false,2001
art-of-illusion,Art of Illusion,Design,3d-modeling,"Open source 3D modeling and rendering studio",http://www.artofillusion.org/,,GPL,linux|macos|windows,cross-platform|3d-modeling|animation,intermediate,false,1999
meshlab,MeshLab,Design,3d-modeling,"Open source tool for processing, editing, and converting 3D triangular meshes",https://www.meshlab.net/,https://github.com/cnr-isti-vclab/meshlab,GPL,linux|macos|windows,cross-platform|3d-modeling,advanced,false,2005
makehuman,MakeHuman,Design,3d-modeling,"Open source tool for creating customizable 3D human characters",https://www.makehumancommunity.org/,https://github.com/makehumancommunity/makehuman,GPL,linux|macos|windows,cross-platform|3d-modeling,intermediate,false,2000
sweet-home-3d,Sweet Home 3D,Design,3d-modeling,"Open source interior design application for drawing floor plans and arranging furniture in 3D",https://www.sweethome3d.com/,,GPL,linux|macos|windows,cross-platform|3d-modeling|beginner-friendly,beginner,false,2006
gmsh,Gmsh,Design,3d-modeling,"Open source finite element mesh generator with built-in CAD and post-processing tools",https://gmsh.info/,https://gitlab.onelab.info/gmsh/gmsh,GPL,linux|macos|windows,cross-platform|3d-modeling,advanced,false,1998
electric,Electric,Design,vector-graphics,"Open source electronic design automation system for circuit and chip layout",http://www.staticfreesoft.com/,,GPL,linux|macos|windows,cross-platform|vector-graphics,advanced,false,1982
joplin,Joplin,Productivity,note-taking,"Open source note-taking and to-do app with synchronization across devices",https://joplinapp.org/,https://github.com/laurent22/joplin,AGPL,linux|macos|windows|android|ios,note-taking|markdown|cross-platform|local-first,beginner,false,2017
inkscape,Inkscape,Design,vector-graphics,"Open source vector graphics editor for illustrations, diagrams, and logos",https://inkscape.org/,https://gitlab.com/inkscape/inkscape,GPL,linux|macos|windows,cross-platform|vector-graphics|illustration,intermediate,false,2003
krita,Krita,Design,image-editing,"Open source digital painting and illustration software with animation support",https://krita.org/,https://github.com/KDE/krita,GPL,linux|macos|windows,cross-platform|image-editing|illustration|animation,intermediate,false,2005
bitwarden,Bitwarden,Security,password-managers,"Open source password manager with encrypted vault sync across devices",https://bitwarden.com/,https://github.com/bitwarden,AGPL,web|linux|macos|windows|android|ios,encrypted|password-manager|cross-platform|cloud|self-hosted,beginner,true,2016
syncthing,Syncthing,Privacy,file-storage,"Open source peer-to-peer file synchronization tool for keeping files in sync across devices",https://syncthing.net/,https://github.com/syncthing/syncthing,MPL,linux|macos|windows|android|ios,self-hosted|cross-platform|privacy-focused|file-management,intermediate,true,2014
element,Element,Privacy,messaging,"Open source Matrix client for secure messaging and collaboration",https://element.io/,https://github.com/element-hq/element-web,GPL,web|linux|macos|windows|android|ios,secure-messaging|end-to-end-encryption|cross-platform|collaborative,beginner,false,2019
penpot,Penpot,Design,ui-ux,"Open source collaborative design and prototyping platform for product teams",https://penpot.app/,https://github.com/penpot/penpot,MPL,web,self-hosted|collaborative|ui-ux,intermediate,true,2021
firefox,Firefox,Privacy,browsers,"Open source web browser focused on privacy, customization, and open standards",https://www.mozilla.org/firefox/,https://github.com/mozilla/gecko-dev,MPL,linux|macos|windows|android|ios,web|privacy-focused|cross-platform,beginner,false,2002
